{
  "$schema": "./acceptance-matrix.schema.json",
  "schema_version": 1,
  "kind": "release_acceptance_plan",
  "date": "2026-10-03",
  "scope_version": "1.0-draft.1",
  "target_version": "1.0.0",
  "is_execution_report": false,
  "status": "planned",
  "baseline": {
    "source_commit": "e10b8dddf03eb96aed4d604d565e9324f58120ce",
    "package_version": "0.1.3",
    "ci_run_url": "https://github.com/Arkus61/agent-harness/actions/runs/37035427836",
    "ci_conclusion": "success",
    "scope": "Observed cross-platform component/contracts/control evidence; no full release criterion PASS is inferred.",
    "catalogue_sha256": "d8313201e2cb2a9a3a9626c9ba004f24e81bba6c52d0565fad85f8ece64dc946"
  },
  "scope_document": "docs/RELEASE_SCOPE_1_0.md",
  "implementation_plan": "docs/superpowers/plans/2026-10-03-full-release.md",
  "native_targets": [
    "linux-x64",
    "linux-arm64",
    "macos-x64",
    "macos-arm64",
    "windows-x64"
  ],
  "gate_order": [
    "G0",
    "G1",
    "G2",
    "G3",
    "G4",
    "G5",
    "G6",
    "G7"
  ],
  "blocking_invariants": [
    "false_or_unjustified_verified",
    "unauthorized_effect",
    "lost_durable_committed_state",
    "unjustified_effect_repeat",
    "credential_canary_leak",
    "silent_isolation_or_platform_downgrade"
  ],
  "rules": [
    "All criteria begin UNKNOWN/not_run; a plan is not an execution receipt.",
    "Preserve all 131 system catalogue criterion IDs and their original requirements.",
    "Missing/partial/skip/UNKNOWN/ERROR cannot satisfy a mandatory criterion.",
    "Unsupported required feature is not NOT_APPLICABLE.",
    "Scenario pass, fixture pass, corpus control pass and live task success are different verdict scopes.",
    "G7 packaging publication is a post-G6 operation; preliminary asset verification may use unpublished drafts.",
    "Private holdout raw cases remain outside agent rights; public output contains only permitted aggregates.",
    "Five-target package/floor criteria need one exact target ID receipt per native_targets entry; three OS-family receipts are insufficient.",
    "Calibration clean blockers include blocking UNKNOWN/Abstain/HOLD/malformed/timeout; separate reporting never excludes them.",
    "Stable3/3 uses three preassigned PRIMARY IDs; primary ERROR is failure; diagnostic retry cannot replace primary.",
    "Q08-Q10 common behavioral scores apply equally; H-only subsystem proof is separate and cannot automatically fail B0/B1.",
    "Runtime/instrumentation/guest/package/version are frozen before G5; G6 only tests exact accepted assets."
  ],
  "counts": {
    "system_scenarios": 42,
    "original_criteria": 131,
    "release_extensions": 58,
    "total_criteria": 189,
    "completed_release_criteria_claimed": 0
  },
  "criteria": [
    {
      "id": "S01.C01",
      "origin": "system_catalogue",
      "scenario_id": "S01",
      "statement": "Созданы worktree, кандидат и квитанции точных обязательных проверок.",
      "mandatory": true,
      "gate": "G1",
      "owner_task": "T04",
      "required_platforms": [
        "linux",
        "macos",
        "windows"
      ],
      "required_profiles": [
        "native-trusted"
      ],
      "execution_modes": [
        "mechanical",
        "scripted_fixture"
      ],
      "applicability": "Все платформы/профили исходного сценария; отсутствие реализации не основание для NOT_APPLICABLE.",
      "oracle": "Git objects + report manifest",
      "planned_evidence": [
        "TaskSpec/hash, input/output SHA, candidate tree, command receipts, reviews, event log"
      ],
      "execution_status": "not_run",
      "verdict": "UNKNOWN"
    },
    {
      "id": "S01.C02",
      "origin": "system_catalogue",
      "scenario_id": "S01",
      "statement": "Изменение соответствует публичным требованиям по независимому oracle.",
      "mandatory": true,
      "gate": "G1",
      "owner_task": "T04",
      "required_platforms": [
        "linux",
        "macos",
        "windows"
      ],
      "required_profiles": [
        "native-trusted"
      ],
      "execution_modes": [
        "mechanical",
        "scripted_fixture"
      ],
      "applicability": "Все платформы/профили исходного сценария; отсутствие реализации не основание для NOT_APPLICABLE.",
      "oracle": "Acceptance tests на exact candidate",
      "planned_evidence": [
        "TaskSpec/hash, input/output SHA, candidate tree, command receipts, reviews, event log"
      ],
      "execution_status": "not_run",
      "verdict": "UNKNOWN"
    },
    {
      "id": "S01.C03",
      "origin": "system_catalogue",
      "scenario_id": "S01",
      "statement": "Исходные HEAD и рабочие файлы пользователя сохранены.",
      "mandatory": true,
      "gate": "G1",
      "owner_task": "T04",
      "required_platforms": [
        "linux",
        "macos",
        "windows"
      ],
      "required_profiles": [
        "native-trusted"
      ],
      "execution_modes": [
        "mechanical",
        "scripted_fixture"
      ],
      "applicability": "Все платформы/профили исходного сценария; отсутствие реализации не основание для NOT_APPLICABLE.",
      "oracle": "Сравнение HEAD и снимка baseline",
      "planned_evidence": [
        "TaskSpec/hash, input/output SHA, candidate tree, command receipts, reviews, event log"
      ],
      "execution_status": "not_run",
      "verdict": "UNKNOWN"
    },
    {
      "id": "S01.C04",
      "origin": "system_catalogue",
      "scenario_id": "S01",
      "statement": "Scripted результат получает только FIXTURE_VERIFIED и не публикуется.",
      "mandatory": true,
      "gate": "G1",
      "owner_task": "T04",
      "required_platforms": [
        "linux",
        "macos",
        "windows"
      ],
      "required_profiles": [
        "native-trusted"
      ],
      "execution_modes": [
        "mechanical",
        "scripted_fixture"
      ],
      "applicability": "Все платформы/профили исходного сценария; отсутствие реализации не основание для NOT_APPLICABLE.",
      "oracle": "CLI merge отказ + fixture flags",
      "planned_evidence": [
        "TaskSpec/hash, input/output SHA, candidate tree, command receipts, reviews, event log"
      ],
      "execution_status": "not_run",
      "verdict": "UNKNOWN"
    },
    {
      "id": "S02.C01",
      "origin": "system_catalogue",
      "scenario_id": "S02",
      "statement": "Неверный контракт отклонён до инструментов и модели.",
      "mandatory": true,
      "gate": "G1",
      "owner_task": "T04",
      "required_platforms": [
        "linux",
        "macos",
        "windows"
      ],
      "required_profiles": [
        "native-trusted"
      ],
      "execution_modes": [
        "mechanical"
      ],
      "applicability": "Все платформы/профили исходного сценария; отсутствие реализации не основание для NOT_APPLICABLE.",
      "oracle": "Отсутствие intents и model calls",
      "planned_evidence": [
        "Invalid fixture JSON, stdout/stderr, event/model-effect counters"
      ],
      "execution_status": "not_run",
      "verdict": "UNKNOWN"
    },
    {
      "id": "S02.C02",
      "origin": "system_catalogue",
      "scenario_id": "S02",
      "statement": "Диагностика указывает конкретную ошибку схемы или поля.",
      "mandatory": true,
      "gate": "G1",
      "owner_task": "T04",
      "required_platforms": [
        "linux",
        "macos",
        "windows"
      ],
      "required_profiles": [
        "native-trusted"
      ],
      "execution_modes": [
        "mechanical"
      ],
      "applicability": "Все платформы/профили исходного сценария; отсутствие реализации не основание для NOT_APPLICABLE.",
      "oracle": "CLI error + validation result",
      "planned_evidence": [
        "Invalid fixture JSON, stdout/stderr, event/model-effect counters"
      ],
      "execution_status": "not_run",
      "verdict": "UNKNOWN"
    },
    {
      "id": "S02.C03",
      "origin": "system_catalogue",
      "scenario_id": "S02",
      "statement": "Корректный контрольный TaskSpec принимается.",
      "mandatory": true,
      "gate": "G1",
      "owner_task": "T04",
      "required_platforms": [
        "linux",
        "macos",
        "windows"
      ],
      "required_profiles": [
        "native-trusted"
      ],
      "execution_modes": [
        "mechanical"
      ],
      "applicability": "Все платформы/профили исходного сценария; отсутствие реализации не основание для NOT_APPLICABLE.",
      "oracle": "Positive control",
      "planned_evidence": [
        "Invalid fixture JSON, stdout/stderr, event/model-effect counters"
      ],
      "execution_status": "not_run",
      "verdict": "UNKNOWN"
    },
    {
      "id": "S03.C01",
      "origin": "system_catalogue",
      "scenario_id": "S03",
      "statement": "Gateway отклоняет точное действие вне grants/ownership.",
      "mandatory": true,
      "gate": "G1",
      "owner_task": "T04",
      "required_platforms": [
        "linux",
        "macos",
        "windows"
      ],
      "required_profiles": [
        "native-trusted"
      ],
      "execution_modes": [
        "mechanical"
      ],
      "applicability": "Все платформы/профили исходного сценария; отсутствие реализации не основание для NOT_APPLICABLE.",
      "oracle": "Gateway result",
      "planned_evidence": [
        "Action hash, grants hash, DENY reason, trap counters"
      ],
      "execution_status": "not_run",
      "verdict": "UNKNOWN"
    },
    {
      "id": "S03.C02",
      "origin": "system_catalogue",
      "scenario_id": "S03",
      "statement": "Запрещённый эффект и subprocess не происходят.",
      "mandatory": true,
      "gate": "G1",
      "owner_task": "T04",
      "required_platforms": [
        "linux",
        "macos",
        "windows"
      ],
      "required_profiles": [
        "native-trusted"
      ],
      "execution_modes": [
        "mechanical"
      ],